{
  "schemaVersion": "poc-1",
  "submissionId": "stage-e-eval-010",
  "revision": 1,
  "source": "LocalStagingPoC",
  "submissionType": "Examination",
  "documents": [
    {
      "documentId": "doc-001",
      "fileName": "document-001.pdf",
      "sha256": "a8a0037928ce9cdc256367965639ec92ed4701028de398852ace79f1d97b2a56"
    }
  ]
}