{
  "schemaVersion": "poc-1",
  "submissionId": "test",
  "revision": 1,
  "source": "LocalStagingPoC",
  "submissionType": "Examination",
  "documents": [
    {
      "documentId": "doc-001",
      "fileName": "note.pdf",
      "sha256": "e38472cde282e01c85dead43936b7fc6a3efa6c4bc6db2c2b6f79d09df7602b9"
    },
    {
      "documentId": "doc-002",
      "fileName": "deed-of-trust.pdf",
      "sha256": "66255aac26a77a45d23cd10d4501ef4440395002937c382f7634a8de27109d09"
    },
    {
      "documentId": "doc-003",
      "fileName": "title-commitment.pdf",
      "sha256": "8a42d04bfbae9ecb6e7c6f2d8f4aef082cf1e215229ac5da153c5acb3d683f96"
    },
    {
      "documentId": "doc-004",
      "fileName": "survey.pdf",
      "sha256": "51b8ce6a4fa1c1cddc46c408674e578e6dacc55c312638e282754058716f8d2c"
    },
    {
      "documentId": "doc-005",
      "fileName": "closing-instructions.pdf",
      "sha256": "e6b23ac028b843b3b4b8d4516132931df8293b4b9c90318ee708fa948af8c484"
    },
    {
      "documentId": "doc-006",
      "fileName": "rider.pdf",
      "sha256": "4b520fbc41eac7c349ee48e5913595e7f84d7cd1c20da709a8f9fecc77b38026"
    }
  ]
}