{"schemaVersion": "poc-1", "submissionId": "stage-e-supported-demo-001", "revision": 1, "source": "LocalStagingPoC", "submissionType": "Examination", "documents": [{"documentId": "doc-001", "fileName": "document-001.pdf", "sha256": "b95f2bc8b9bd3b1e9077c1d1363cdb3256de7e39fcc2bc6b7273d441b4e1f524"}, {"documentId": "doc-002", "fileName": "document-002.pdf", "sha256": "200ae800a5990082f4deab95ae2351d46750b2525495cec8c468c98ded50932d"}, {"documentId": "doc-003", "fileName": "document-003.pdf", "sha256": "8ca64fc2b0e0caf6f09bd4b19ae8c7e33a7653f3919b5addb6ecc8888fe59978"}, {"documentId": "doc-004", "fileName": "document-004.pdf", "sha256": "5bedb877874c26cae60e80e0449389e25ba5be1b153d10ea9541abc9116c4ac6"}, {"documentId": "doc-005", "fileName": "document-005.pdf", "sha256": "76f495101ef3bbf60e3cf2fd76398db49e16242839b895150b3a60903f73b354"}, {"documentId": "doc-006", "fileName": "document-006.pdf", "sha256": "0f2edb53c5c5b747c03362580212b9d7941b46826a2f8df7ac6bac7b7f7f8257"}]}